2005-0361-IND,No,nat-hyd-flo-riv,Natural,Hydrological,Flood,Riverine flood,,,IND,India,Southern Asia,Asia,"Sangla, Kalpa, Yangthang, Sumdo, Khab, Karcham, Leo, Akpa, Kharo villages (Kinnaur district, Himachal Pradesh province), Rampur Bushahr village (Shimla district, Himachal Pradesh province), Kullu, Bilaspur, Mandi districts (Himachal Pradesh)",Heavy rains,Broken Dam/Burst bank,No,No,No,,6530,Km2,,,"Sutlej, Parechu, Spiti",2005,6,26,2005,6,29,6,,5000,,5000,,,,,23000,35885,64.0927402574269,"[{""adm2_code"":17666,""adm2_name"":""Bilaspur""},{""adm2_code"":17670,""adm2_name"":""Kinnaur""},{""adm2_code"":17671,""adm2_name"":""Kullu""},{""adm2_code"":17673,""adm2_name"":""Mandi""},{""adm2_code"":17674,""adm2_name"":""Shimla""}]",2005-09-14,2023-09-25
2005-0375-BGD,No,nat-hyd-flo-riv,Natural,Hydrological,Flood,Riverine flood,,,BGD,Bangladesh,Southern Asia,Asia,"Kurigram, Gaibandha, Lalmonirhat, Rangpur, Nilphamari districts (Rangpur province), Sherpur, Jamalpur, Dhaka, Narayanganj, Munshiganj, Madaripur, districts (Dhaka province), Sirajganj, Bogra districts (Rajshahi province)",Monsoonal rain,,No,No,No,,,Km2,,,"Brahammaputra-Jamuna and Ganges-Padma-Meghna basins - Teesta, Dharla, Brahmaputra, Kortoa, Ghagot",2005,7,7,2005,7,27,23,,1000000,,1000000,,,,,,,64.0927402574269,"[{""adm2_code"":5778,""adm2_name"":""Dhaka""},{""adm2_code"":5782,""adm2_name"":""Jamalpur""},{""adm2_code"":5784,""adm2_name"":""Madaripur""},{""adm2_code"":5786,""adm2_name"":""Munshiganj""},{""adm2_code"":5788,""adm2_name"":""Narayanganj""},{""adm2_code"":5793,""adm2_name"":""Sherpur""},{""adm2_code"":5805,""adm2_name"":""Bogra""},{""adm2_code"":5819,""adm2_name"":""Sirajganj""},{""adm2_code"":5807,""adm2_name"":""Gaibandha""},{""adm2_code"":5809,""adm2_name"":""Kurigram""},{""adm2_code"":5810,""adm2_name"":""Lalmonirhat""},{""adm2_code"":5814,""adm2_name"":""Nilphamari""},{""adm2_code"":5818,""adm2_name"":""Rangpur""}]",2005-09-14,2023-09-25
2005-0375-IND,No,nat-hyd-flo-riv,Natural,Hydrological,Flood,Riverine flood,,,IND,India,Southern Asia,Asia,"Yingkiong village (Upper Siang (70051) district, Arunachal Pradesh province), Seppa village (East Kameng (70040) district, Arunachal Pradesh province), Anini village (70050 district, Arunachal Pradesh province), Dibrugarh, Sonitpur, Sibsagar, Dhemaji, Tinsukia, Karimganj, Lakhimpur, Jorhat, Morigaon, Dhuburi, Goalpara, Barpeta districts (Assam province), Bahraich, Shravasti, Banda, Ballia, Lakhimpur Kheri, Kanpur, Varanasi, Mainpuri districts (Uttar Pradesh province), Haridwar, Uttarkashi, Naini Tal, Dehran Dun districts (Uttarakhand province), Muzaffarpur, Darbhanga, Madhubani districts (Bihar province), Birbhum district (West Bengal province)",Monsoon rain,"Slide (land, mud, snow, rock)",No,No,No,,,Km2,,,"Brahmaputra and tributaries. Lohit, Dikhow, Jai Bharati, Puthimari, Subansairi, Dhansiri, Durra, Burhi-Dehing, Kundli, Jiyadhol, Lali and Siang, Barak. Ganges and tributaries. Baghmati, Ganga, Sharda, Gandak, Yamuna, Varuna, Nagwa nullah, Kane, Kosi, Bagmati, Kamla, Budi Gandak, Rapti, Ghaghra, Gomti, Ken, Budhi Rapti.",2005,7,7,2005,7,28,70,,1904000,4000,1908000,,,,,,,64.0927402574269,"[{""adm2_code"":17576,""adm2_name"":""Barpeta""},{""adm2_code"":17579,""adm2_name"":""Dhuburi""},{""adm2_code"":17580,""adm2_name"":""Dibrugarh""},{""adm2_code"":17581,""adm2_name"":""Goalpara""},{""adm2_code"":17585,""adm2_name"":""Karimganj""},{""adm2_code"":17592,""adm2_name"":""Sibsagar""},{""adm2_code"":17593,""adm2_name"":""Sonitpur""},{""adm2_code"":70087,""adm2_name"":""Dhemaji""},{""adm2_code"":70089,""adm2_name"":""Jorhat""},{""adm2_code"":70091,""adm2_name"":""Lakhimpur""},{""adm2_code"":70092,""adm2_name"":""Marigaon""},{""adm2_code"":70093,""adm2_name"":""Tinsukia""},{""adm2_code"":17947,""adm2_name"":""Birbhum""},{""adm2_code"":70040,""adm2_name"":""Administrative unit not available""},{""adm2_code"":70050,""adm2_name"":""Administrative unit not available""},{""adm2_code"":70051,""adm2_name"":""Administrative unit not available""},{""adm2_code"":17598,""adm2_name"":""Darbhanga""},{""adm2_code"":17611,""adm2_name"":""Madhubani""},{""adm2_code"":17613,""adm2_name"":""Muzaffarpur""},{""adm2_code"":17893,""adm2_name"":""Bahraich""},{""adm2_code"":17894,""adm2_name"":""Ballia""},{""adm2_code"":17895,""adm2_name"":""Banda""},{""adm2_code"":17920,""adm2_name"":""Kanpur""},{""adm2_code"":17921,""adm2_name"":""Lakhimpur Kheri""},{""adm2_code"":17924,""adm2_name"":""Mainpuri""},{""adm2_code"":17943,""adm2_name"":""Varanasi""},{""adm2_code"":70277,""adm2_name"":""Shravasti""},{""adm2_code"":17903,""adm2_name"":""Dehra Dun""},{""adm2_code"":70284,""adm2_name"":""Haridwar""},{""adm2_code"":70285,""adm2_name"":""Naini Tal""},{""adm2_code"":70289,""adm2_name"":""Uttarkashi""}]",2005-09-14,2023-09-25
2005-0375-NPL,No,nat-hyd-flo-riv,Natural,Hydrological,Flood,Riverine flood,,,NPL,Nepal,Southern Asia,Asia,"Banke area (Bheri district, Mid Western province), Sunsari area (Koshi district, Eastern province)",Monsoonal rain,,No,No,No,,,Km2,,,"Rapti, Bagmati and Lalbakaiya, Saptakosi",2005,7,7,2005,7,27,,,30000,,30000,,,,,,,64.0927402574269,"[{""adm2_code"":22354,""adm2_name"":""Koshi""},{""adm2_code"":22361,""adm2_name"":""Bheri""}]",2005-09-14,2023-09-25
2005-0398-IND,No,nat-hyd-flo-riv,Natural,Hydrological,Flood,Riverine flood,,,IND,India,Southern Asia,Asia,"Ashoknagar, Chhatarpur, Damoh, Jabalpur, Katni, Narsinghpur, Panna, Rewa, Sagar, Satna districts (Madhya Pradesh province)",Monsoonal rains,,No,No,No,,55740,Km2,,,"Maijee, Simrol and Katni, Tons, Ledraha, Mahanadi, Son, Banganga",2005,7,2,2005,7,15,62,,49000,,49000,,,,,,,64.0927402574269,"[{""adm2_code"":17718,""adm2_name"":""Chhatarpur""},{""adm2_code"":17720,""adm2_name"":""Damoh""},{""adm2_code"":17730,""adm2_name"":""Jabalpur""},{""adm2_code"":17735,""adm2_name"":""Narsinghpur""},{""adm2_code"":17736,""adm2_name"":""Panna""},{""adm2_code"":17743,""adm2_name"":""Rewa""},{""adm2_code"":17744,""adm2_name"":""Sagar""},{""adm2_code"":17745,""adm2_name"":""Satna""},{""adm2_code"":70169,""adm2_name"":""Ashoknagar""},{""adm2_code"":70174,""adm2_name"":""Katni""}]",2005-09-12,2023-09-25
2005-0399-IND,No,nat-hyd-flo-riv,Natural,Hydrological,Flood,Riverine flood,,,IND,India,Southern Asia,Asia,"Adilabad, Hyderabad, Karimnagar, Khammam, Mahbubnagar, Medak, Nalgonda, Nizamabad, Rangareddi, Warangal, East Godavari, Guntur, Krishna, Nellore, Prakasam, Srikakulam, Vishakhapatnam, Vizianagaram, West Godavari districts (Andhra Pradesh province)",Heavy rains,,No,No,No,,,Km2,,,,2005,7,10,2005,7,10,12,,10000,,10000,,,,,,,64.0927402574269,"[{""adm2_code"":17547,""adm2_name"":""Adilabad""},{""adm2_code"":17551,""adm2_name"":""East Godavari""},{""adm2_code"":17552,""adm2_name"":""Guntur""},{""adm2_code"":17553,""adm2_name"":""Hyderabad""},{""adm2_code"":17554,""adm2_name"":""Karimnagar""},{""adm2_code"":17555,""adm2_name"":""Khammam""},{""adm2_code"":17556,""adm2_name"":""Krishna""},{""adm2_code"":17558,""adm2_name"":""Mahbubnagar""},{""adm2_code"":17559,""adm2_name"":""Medak""},{""adm2_code"":17560,""adm2_name"":""Nalgonda""},{""adm2_code"":17561,""adm2_name"":""Nellore""},{""adm2_code"":17562,""adm2_name"":""Nizamabad""},{""adm2_code"":17563,""adm2_name"":""Prakasam""},{""adm2_code"":17564,""adm2_name"":""Rangareddi""},{""adm2_code"":17565,""adm2_name"":""Srikakulam""},{""adm2_code"":17566,""adm2_name"":""Vishakhapatnam""},{""adm2_code"":17567,""adm2_name"":""Vizianagaram""},{""adm2_code"":17568,""adm2_name"":""Warangal""},{""adm2_code"":17569,""adm2_name"":""West Godavari""}]",2005-08-04,2023-09-25
2005-0409-IND,No,nat-hyd-flo-riv,Natural,Hydrological,Flood,Riverine flood,,,IND,India,Southern Asia,Asia,"Gujarat, Madhya Pradesh, Maharashtra, Goa, Orissa, Karnataka, Himachal Pradesh, Jammu and Kashmir provinces",Monsoon rain,"Broken Dam/Burst bank|Slide (land, mud, snow, rock)",Yes,No,No,12,35550,Km2,,,"Ghawanda, Koyna, Kal, Savitira, Karad, Pawana, Mithi, Mitha and Mula",2005,7,24,2005,8,5,1200,55,20000000,,20000055,,,844000,1316842,3330000,5195596,64.0927402574269,"[{""adm1_code"":1490,""adm1_name"":""Goa""},{""adm1_code"":1491,""adm1_name"":""Gujarat""},{""adm1_code"":1493,""adm1_name"":""Himachal Pradesh""},{""adm1_code"":1494,""adm1_name"":""Karnataka""},{""adm1_code"":1498,""adm1_name"":""Maharashtra""},{""adm1_code"":1504,""adm1_name"":""Orissa""},{""adm1_code"":40408,""adm1_name"":""Administrative unit not available""},{""adm1_code"":40409,""adm1_name"":""Administrative unit not available""},{""adm1_code"":40422,""adm1_name"":""Administrative unit not available""},{""adm1_code"":40423,""adm1_name"":""Administrative unit not available""},{""adm1_code"":40424,""adm1_name"":""Administrative unit not available""},{""adm1_code"":40425,""adm1_name"":""Administrative unit not available""},{""adm1_code"":40426,""adm1_name"":""Administrative unit not available""},{""adm1_code"":40427,""adm1_name"":""Administrative unit not available""},{""adm1_code"":40428,""adm1_name"":""Administrative unit not available""},{""adm1_code"":40429,""adm1_name"":""Administrative unit not available""},{""adm1_code"":40430,""adm1_name"":""Administrative unit not available""},{""adm1_code"":40431,""adm1_name"":""Administrative unit not available""},{""adm1_code"":70079,""adm1_name"":""Madhya Pradesh""}]",2006-01-16,2023-09-25
2005-0414-IRN,No,nat-hyd-flo-riv,Natural,Hydrological,Flood,Riverine flood,,,IRN,Iran (Islamic Republic of),Southern Asia,Asia,"Kalaleh city (Minudasht district, Golestan province)",Heavy rains,,No,No,No,,4580,Km2,,,,2005,7,31,2005,8,1,52,,,,,,,,,,,64.0927402574269,"[{""adm2_code"":41040,""adm2_name"":""Minudasht""}]",2005-09-08,2023-09-25
2005-0426-IRN,No,nat-hyd-flo-riv,Natural,Hydrological,Flood,Riverine flood,,,IRN,Iran (Islamic Republic of),Southern Asia,Asia,"Kalaleh city (Minudasht district, Golestan province)",Heavy rains,,No,No,No,,4900,Km2,,,,2005,8,9,2005,8,11,43,,,1750,1750,,,,,,,64.0927402574269,"[{""adm2_code"":41040,""adm2_name"":""Minudasht""}]",2005-09-07,2023-09-25
2005-0436-IRN,No,nat-hyd-flo-flo,Natural,Hydrological,Flood,Flood (General),,,IRN,Iran (Islamic Republic of),Southern Asia,Asia,Mazandaran province,,,No,No,No,,,Km2,,,,2005,8,15,2005,8,15,11,,,,,,,,,,,64.0927402574269,"[{""adm1_code"":1557,""adm1_name"":""Mazandaran""}]",2005-09-07,2023-09-25
2005-0471-IND,No,nat-hyd-flo-fla,Natural,Hydrological,Flood,Flash flood,,,IND,India,Southern Asia,Asia,Azamgarh district (Uttar Pradesh province),Heavy rains,"Slide (land, mud, snow, rock)",No,No,No,,12680,Km2,,,"Ghaghra, Saryu rivers",2005,8,26,2005,8,28,27,,800000,,800000,,,,,,,64.0927402574269,"[{""adm2_code"":17892,""adm2_name"":""Azamgarh""}]",2006-02-28,2023-09-25
2005-0504-IND,No,nat-hyd-flo-riv,Natural,Hydrological,Flood,Riverine flood,,,IND,India,Southern Asia,Asia,"Karnataka, Andhra Pradesh provinces",Monsoonal rain,Broken Dam/Burst bank,No,No,No,,619200,Km2,,,Krishna and Godavari and tributaries,2005,7,23,2005,8,16,126,,100000,,100000,,,,,,,64.0927402574269,"[{""adm1_code"":1485,""adm1_name"":""Andhra Pradesh""},{""adm1_code"":1494,""adm1_name"":""Karnataka""}]",2005-09-09,2023-09-25
2005-0511-AFG,No,nat-hyd-flo-riv,Natural,Hydrological,Flood,Riverine flood,,,AFG,Afghanistan,Southern Asia,Asia,Ghaziabad district (Kunar province),Torrential rains,,No,No,No,,3200,Km2,,,,2005,9,11,2005,9,12,12,,,,,,,,,,,64.0927402574269,"[{""adm1_code"":288,""adm1_name"":""Kunar""}]",2006-01-13,2023-09-25
2005-0539-IND,No,nat-hyd-flo-riv,Natural,Hydrological,Flood,Riverine flood,,,IND,India,Southern Asia,Asia,"Himachal Pradesh, Uttar Pradesh, Uttarakhand provinces",Monsoonal rain,"Slide (land, mud, snow, rock)",No,No,No,,308700,Km2,,,Ganges tributaris,2005,9,16,2005,9,19,23,4,,2500,2504,,,,,,,64.0927402574269,"[{""adm1_code"":1493,""adm1_name"":""Himachal Pradesh""},{""adm1_code"":70081,""adm1_name"":""Uttar Pradesh""},{""adm1_code"":70082,""adm1_name"":""Uttarakhand""}]",2006-04-27,2023-09-25
2005-0541-IND,No,nat-hyd-flo-riv,Natural,Hydrological,Flood,Riverine flood,,,IND,India,Southern Asia,Asia,"Raj Nandgaon, Durg districts (Chhattisgarh province), Baleshwar, Bhadrak, Jajpur districts (Orissa province), Bhandara, Gondiya, Nagpur districts (Maharashtra province), Balaghat, Katni, Jabalpur, Seoni districts (Madhya Pradesh province)",,Broken Dam/Burst bank,No,No,No,,312900,Km2,,,"Budhabalanga, Subarnarekha, Baitarani, Mahanadi, Kathajod, Shivnath, Banganga",2005,9,14,2005,9,20,89,,550000,,550000,,,,,420000,655300,64.0927402574269,"[{""adm2_code"":17761,""adm2_name"":""Bhandara""},{""adm2_code"":17771,""adm2_name"":""Nagpur""},{""adm2_code"":70180,""adm2_name"":""Gondiya""},{""adm2_code"":70207,""adm2_name"":""Baleshwar""},{""adm2_code"":70209,""adm2_name"":""Bhadrak""},{""adm2_code"":70215,""adm2_name"":""Jajpur""},{""adm2_code"":17724,""adm2_name"":""Durg""},{""adm2_code"":70117,""adm2_name"":""Raj Nandgaon""},{""adm2_code"":17712,""adm2_name"":""Balaghat""},{""adm2_code"":17730,""adm2_name"":""Jabalpur""},{""adm2_code"":17747,""adm2_name"":""Seoni""},{""adm2_code"":70174,""adm2_name"":""Katni""}]",2006-04-19,2023-09-25
2005-0556-NPL,No,nat-hyd-flo-riv,Natural,Hydrological,Flood,Riverine flood,,,NPL,Nepal,Southern Asia,Asia,"Kanchanpur, Baitadi, Dadeldhura, Darchula areas (Mahakali district, Far Western province)",Late monsoon rains,"Broken Dam/Burst bank|Slide (land, mud, snow, rock)",No,No,No,,8030,Km2,,,"Mahakali, Shirsha, Ragoon",2005,9,24,2005,9,29,51,,1600,,1600,,,,,,,64.0927402574269,"[{""adm2_code"":22357,""adm2_name"":""Mahakali""}]",2006-02-28,2023-09-25
2005-0590-BGD,No,nat-hyd-flo-fla,Natural,Hydrological,Flood,Flash flood,,,BGD,Bangladesh,Southern Asia,Asia,"Naogaon, Joypurhat district (Rajshahi province), Gaibandha, Rangpur, Nilphamari, Dinajpur districts (Rangpur province)",Mosoon rains,,No,No,No,,22570,Km2,,,"Jamuneshwari, Chhoto Jamuna",2005,10,3,2005,10,20,19,,100000,,100000,,,,,,,64.0927402574269,"[{""adm2_code"":5808,""adm2_name"":""Joypurhat""},{""adm2_code"":5811,""adm2_name"":""Naogaon""},{""adm2_code"":5806,""adm2_name"":""Dinajpur""},{""adm2_code"":5807,""adm2_name"":""Gaibandha""},{""adm2_code"":5814,""adm2_name"":""Nilphamari""},{""adm2_code"":5818,""adm2_name"":""Rangpur""}]",2007-01-15,2023-09-25
2005-0599-IND,No,nat-hyd-flo-riv,Natural,Hydrological,Flood,Riverine flood,,,IND,India,Southern Asia,Asia,"East Midnapore, South 24 Parganas, Barddhaman, Nadia districts (West Bengal province), Baleshwar district (Orissa province)",Heavy rains,,No,No,No,,29110,Km2,,,Ichachamati and tributaries,2005,10,21,2005,10,24,19,,2000000,250000,2250000,,,,,117000,182548,64.0927402574269,"[{""adm2_code"":70207,""adm2_name"":""Baleshwar""},{""adm2_code"":17946,""adm2_name"":""Barddhaman""},{""adm2_code"":17956,""adm2_name"":""Nadia""},{""adm2_code"":70291,""adm2_name"":""East Midnapore""},{""adm2_code"":70294,""adm2_name"":""South 24 Parganas""}]",2005-10-25,2023-09-25
2005-0603-IND,No,nat-hyd-flo-riv,Natural,Hydrological,Flood,Riverine flood,,,IND,India,Southern Asia,Asia,"Surat, Vadodara, Bhavnagar, Panch Mahals, Narmada districts (Gujarat province)",Heavy rains,Broken Dam/Burst bank,No,No,No,,53200,Km2,,,"Vishwamitri, Tapi",2005,9,22,2005,10,11,15,,,,,,,,,,,64.0927402574269,"[{""adm2_code"":17639,""adm2_name"":""Bhavnagar""},{""adm2_code"":17649,""adm2_name"":""Surat""},{""adm2_code"":17652,""adm2_name"":""Vadodara""},{""adm2_code"":70126,""adm2_name"":""Narmada""},{""adm2_code"":70128,""adm2_name"":""Panch Mahals""}]",2005-10-25,2023-09-25
2005-0627-IND,No,nat-hyd-flo-riv,Natural,Hydrological,Flood,Riverine flood,,,IND,India,Southern Asia,Asia,"Salem, Namakkal, Karur, Erode, Tiruchchirappalli, Vellore, Perambalur, Nagapattinam, Kanniyakumari, Dharmapuri, Madurai, Villupuram, Chennai, Cuddalore districts (Tamil Nadu province), Karaikal district (Puducherry province), Bangalore Rural, Bangalore Urban, Mysore districts (Karnataka province), Nellore, Chittoor, Vishakhapatnam, Srikakulam, Vizianagaram, Cuddapah districts (Andhra Pradesh province), West Bengal, Orissa provinces",Monsoonal rain,,No,No,No,,131300,Km2,,,"Cauvery, Coleroon, Palar, Pennar, Papaghni, Nagavali, Vamsadhara, Bhavani",2005,10,23,2005,11,13,162,,2000000,,2000000,,,,,,,64.0927402574269,"[{""adm1_code"":1504,""adm1_name"":""Orissa""},{""adm1_code"":1511,""adm1_name"":""West Bengal""},{""adm2_code"":17549,""adm2_name"":""Chittoor""},{""adm2_code"":17550,""adm2_name"":""Cuddapah""},{""adm2_code"":17561,""adm2_name"":""Nellore""},{""adm2_code"":17565,""adm2_name"":""Srikakulam""},{""adm2_code"":17566,""adm2_name"":""Vishakhapatnam""},{""adm2_code"":17567,""adm2_name"":""Vizianagaram""},{""adm2_code"":17692,""adm2_name"":""Mysore""},{""adm2_code"":70158,""adm2_name"":""Bangalore Rural""},{""adm2_code"":70159,""adm2_name"":""Bangalore Urban""},{""adm2_code"":17868,""adm2_name"":""Dharmapuri""},{""adm2_code"":17870,""adm2_name"":""Kanniyakumari""},{""adm2_code"":17875,""adm2_name"":""Erode""},{""adm2_code"":17879,""adm2_name"":""Salem""},{""adm2_code"":17883,""adm2_name"":""Tiruchchirappalli""},{""adm2_code"":70242,""adm2_name"":""Chennai""},{""adm2_code"":70243,""adm2_name"":""Cuddalore""},{""adm2_code"":70245,""adm2_name"":""Karur""},{""adm2_code"":70246,""adm2_name"":""Madurai""},{""adm2_code"":70247,""adm2_name"":""Nagapattinam""},{""adm2_code"":70248,""adm2_name"":""Namakkal""},{""adm2_code"":70249,""adm2_name"":""Perambalur""},{""adm2_code"":70254,""adm2_name"":""Vellore""},{""adm2_code"":70255,""adm2_name"":""Villupuram""},{""adm2_code"":70226,""adm2_name"":""Karaikal""}]",2006-04-27,2023-09-25
2005-0646-LKA,No,nat-hyd-flo-riv,Natural,Hydrological,Flood,Riverine flood,,,LKA,Sri Lanka,Southern Asia,Asia,"Colombo, Gampaha districts (Western province), Trincomalee district (Eastern province), Jaffna, Kilinochchi, Mullattivu districts (Northern province)",Monsoonal rain,"Slide (land, mud, snow, rock)",No,No,No,,29870,Km2,,,,2005,11,21,2005,11,23,6,,145000,,145000,,,,,,,64.0927402574269,"[{""adm2_code"":25834,""adm2_name"":""Trincomalee""},{""adm2_code"":25839,""adm2_name"":""Jaffna""},{""adm2_code"":25840,""adm2_name"":""Kilinochchi""},{""adm2_code"":25842,""adm2_name"":""Mullattivu""},{""adm2_code"":25851,""adm2_name"":""Colombo""},{""adm2_code"":25852,""adm2_name"":""Gampaha""}]",2006-01-24,2023-09-25
2005-0677-IND,No,nat-hyd-flo-riv,Natural,Hydrological,Flood,Riverine flood,,,IND,India,Southern Asia,Asia,Tamil Nadu province,Torrential rains,,No,No,No,,,Km2,,,,2005,12,2,2005,12,3,30,,200000,,200000,,,,,,,64.0927402574269,"[{""adm1_code"":1508,""adm1_name"":""Tamil Nadu""}]",2005-12-08,2023-09-25
2005-0725-AFG,No,nat-hyd-flo-riv,Natural,Hydrological,Flood,Riverine flood,,,AFG,Afghanistan,Southern Asia,Asia,Mazar-e-Sharif district (Balkh province),Heavy rains,,No,No,No,,,Km2,,,,2005,12,28,2005,12,28,,,,150,150,,,,,,,64.0927402574269,"[{""adm2_code"":3487,""adm2_name"":""Mazar-e-Sharif""}]",2006-01-10,2023-09-25
2005-0736-AFG,No,nat-hyd-flo-riv,Natural,Hydrological,Flood,Riverine flood,,,AFG,Afghanistan,Southern Asia,Asia,"Dehdadi district (Balkh province), Emamsaheb district (Kunduz province)",Heavy and melting snow,,No,No,No,,,Km2,,,,2005,12,27,2005,12,29,,,,125,125,,,,,,,64.0927402574269,"[{""adm2_code"":3482,""adm2_name"":""Dehdadi""},{""adm2_code"":3640,""adm2_name"":""Emamsaheb""}]",2006-01-18,2023-09-25
2005-0746-IND,No,nat-hyd-flo-riv,Natural,Hydrological,Flood,Riverine flood,,,IND,India,Southern Asia,Asia,"Himachal Pradesh, Punjab, Jammu and Kashmir, Haryana provinces",Mosnoon rain,,No,No,No,,,Km2,,,"Chenab, Ravi, Beas, Pabbar, Tawi, Ujh",2005,7,5,2005,8,14,10,,2000,,2000,,,,,,,64.0927402574269,"[{""adm1_code"":1492,""adm1_name"":""Haryana""},{""adm1_code"":1493,""adm1_name"":""Himachal Pradesh""},{""adm1_code"":1505,""adm1_name"":""Punjab""},{""adm1_code"":40422,""adm1_name"":""Administrative unit not available""},{""adm1_code"":40423,""adm1_name"":""Administrative unit not available""},{""adm1_code"":40424,""adm1_name"":""Administrative unit not available""},{""adm1_code"":40425,""adm1_name"":""Administrative unit not available""},{""adm1_code"":40426,""adm1_name"":""Administrative unit not available""},{""adm1_code"":40427,""adm1_name"":""Administrative unit not available""},{""adm1_code"":40428,""adm1_name"":""Administrative unit not available""},{""adm1_code"":40429,""adm1_name"":""Administrative unit not available""},{""adm1_code"":40430,""adm1_name"":""Administrative unit not available""},{""adm1_code"":40431,""adm1_name"":""Administrative unit not available""}]",2006-01-24,2023-09-25
2005-0746-PAK,No,nat-hyd-flo-riv,Natural,Hydrological,Flood,Riverine flood,,,PAK,Pakistan,Southern Asia,Asia,"Punjab, Sindh, Jammu and Kashmir provinces",Monsoonal rain,Broken Dam/Burst bank,No,No,No,,,Km2,,,Indus river and tributaries,2005,7,5,2005,8,14,42,20,58000,,58020,,,,,,,64.0927402574269,"[{""adm1_code"":2276,""adm1_name"":""Punjab""},{""adm1_code"":2277,""adm1_name"":""Sindh""},{""adm1_code"":40408,""adm1_name"":""Administrative unit not available""},{""adm1_code"":40409,""adm1_name"":""Administrative unit not available""}]",2006-02-27,2023-09-25
2006-0207-IND,No,nat-hyd-flo-fla,Natural,Hydrological,Flood,Flash flood,,,IND,India,Southern Asia,Asia,"Adilabad, Hyderabad, Karimnagar, Khammam, Mahbubnagar, Medak, Nalgonda, Nizamabad, Rangareddi, Warangal, Srikakulam, Krishna districts (Andhra Pradesh province)",Heavy rain,,No,No,No,,190900,Km2,17.43,82.81,,2006,4,15,2006,4,18,20,,,,,,,,,,,66.1603305617979,"[{""adm2_code"":17547,""adm2_name"":""Adilabad""},{""adm2_code"":17553,""adm2_name"":""Hyderabad""},{""adm2_code"":17554,""adm2_name"":""Karimnagar""},{""adm2_code"":17555,""adm2_name"":""Khammam""},{""adm2_code"":17556,""adm2_name"":""Krishna""},{""adm2_code"":17558,""adm2_name"":""Mahbubnagar""},{""adm2_code"":17559,""adm2_name"":""Medak""},{""adm2_code"":17560,""adm2_name"":""Nalgonda""},{""adm2_code"":17562,""adm2_name"":""Nizamabad""},{""adm2_code"":17564,""adm2_name"":""Rangareddi""},{""adm2_code"":17565,""adm2_name"":""Srikakulam""},{""adm2_code"":17568,""adm2_name"":""Warangal""}]",2007-01-04,2023-09-25
2006-0221-AFG,No,nat-hyd-flo-fla,Natural,Hydrological,Flood,Flash flood,,,AFG,Afghanistan,Southern Asia,Asia,"Garziwan district (Faryab province), Doshi district (Baghlan province), Kohestanat district (Sar-e-Pul province)",Brief torrential rain and snowmelt,,No,No,No,,58310,Km2,35.67,66.83,,2006,4,28,2006,5,1,19,25,5000,,5025,,,,,,,66.1603305617979,"[{""adm2_code"":3470,""adm2_name"":""Doshi""},{""adm2_code"":99955,""adm2_name"":""Garziwan""},{""adm2_code"":3730,""adm2_name"":""Kohestanat""}]",2007-01-04,2023-09-25
2006-0245-IRN,No,nat-hyd-flo-riv,Natural,Hydrological,Flood,Riverine flood,,,IRN,Iran (Islamic Republic of),Southern Asia,Asia,Ardebil province,Heavy rains,,No,No,No,,18310,Km2,38.69,47.88,,2006,5,8,2006,5,13,14,,2800,,2800,,,,,16000,24184,66.1603305617979,"[{""adm1_code"":33110,""adm1_name"":""Ardebil""}]",2007-01-05,2023-09-25
2006-0262-BGD,No,nat-hyd-flo-riv,Natural,Hydrological,Flood,Riverine flood,,,BGD,Bangladesh,Southern Asia,Asia,"Khagrachhari district (Chittagong province), Sylhet province",Monsoonal rain,,No,No,No,,,Km2,,,Jamuna and tributaries,2006,5,31,2006,7,24,,,76000,,76000,,,,,,,66.1603305617979,"[{""adm1_code"":580,""adm1_name"":""Sylhet""},{""adm2_code"":5774,""adm2_name"":""Khagrachhari""}]",2007-01-06,2023-09-25
2006-0262-IND,No,nat-hyd-flo-riv,Natural,Hydrological,Flood,Riverine flood,,,IND,India,Southern Asia,Asia,"Assam, Tripura provinces",Monsoonal rain,,No,No,No,,47020,Km2,26.6,94.02,Brahmaputra and tributaries,2006,5,31,2006,7,24,21,,504000,,504000,,,,,,,66.1603305617979,"[{""adm1_code"":1487,""adm1_name"":""Assam""},{""adm1_code"":1509,""adm1_name"":""Tripura""}]",2007-01-06,2023-09-25
2006-0263-IND,No,nat-hyd-flo-riv,Natural,Hydrological,Flood,Riverine flood,,,IND,India,Southern Asia,Asia,Kerala province,Monsoonal rain,,No,No,No,,42690,Km2,10.54,76.05,,2006,5,25,2006,6,2,32,,10800,,10800,,,,,,,66.1603305617979,"[{""adm1_code"":1495,""adm1_name"":""Kerala""}]",2007-01-06,2023-09-25
2006-0265-IND,No,nat-hyd-flo-riv,Natural,Hydrological,Flood,Riverine flood,,,IND,India,Southern Asia,Asia,"Maharashtra, Gujarat provinces",Monsoonal rain,,No,No,No,,395400,Km2,18.73,75.23,,2006,5,31,2006,6,4,41,,,,,,,,,,,66.1603305617979,"[{""adm1_code"":1491,""adm1_name"":""Gujarat""},{""adm1_code"":1498,""adm1_name"":""Maharashtra""}]",2007-01-06,2023-09-25
2006-0271-AFG,No,nat-hyd-flo-riv,Natural,Hydrological,Flood,Riverine flood,,,AFG,Afghanistan,Southern Asia,Asia,"Chagcharan, Shahrak districts (Ghor province), Farkhar district (Takhar province), Taloqan city (Taloqan districts, Takhar province)",Heavy rains,,No,No,No,,21480,Km2,34.52,65.56,,2006,5,19,2006,5,23,21,150,465,,615,,,,,,,66.1603305617979,"[{""adm2_code"":99967,""adm2_name"":""Shahrak""},{""adm2_code"":99970,""adm2_name"":""Chaghcharan""},{""adm2_code"":3744,""adm2_name"":""Taloqan""},{""adm2_code"":99991,""adm2_name"":""Farkhar""}]",2007-01-06,2023-09-25
2006-0291-AFG,No,nat-hyd-flo-riv,Natural,Hydrological,Flood,Riverine flood,,,AFG,Afghanistan,Southern Asia,Asia,"Garziwan, Bilcheragh districts (Faryab province)","Melting snow, sesonal rains",,No,No,No,,,Km2,,,,2006,5,,2006,5,,,,1735,,1735,,,,,,,66.1603305617979,"[{""adm2_code"":99955,""adm2_name"":""Garziwan""},{""adm2_code"":99956,""adm2_name"":""Bilcheragh""}]",2007-01-06,2023-09-25
2006-0342-IND,No,nat-hyd-flo-riv,Natural,Hydrological,Flood,Riverine flood,,,IND,India,Southern Asia,Asia,"Ballia, Chandauli districts (Uttar Pradesh province)",Monsoonal rain,,No,No,No,,13110,Km2,25.62,83.67,Ganges and tributaries,2006,6,24,2006,6,27,130,,300000,,300000,,,,,,,66.1603305617979,"[{""adm2_code"":17894,""adm2_name"":""Ballia""},{""adm2_code"":70262,""adm2_name"":""Chandauli""}]",2007-01-06,2023-09-25
