DisNo.,Historic,Classification Key,Disaster Group,Disaster Subgroup,Disaster Type,Disaster Subtype,External IDs,Event Name,ISO,Country,Subregion,Region,Location,Origin,Associated Types,OFDA/BHA Response,Appeal,Declaration,AID Contribution ('000 US$),Magnitude,Magnitude Scale,Latitude,Longitude,River Basin,Start Year,Start Month,Start Day,End Year,End Month,End Day,Total Deaths,No. Injured,No. Affected,No. Homeless,Total Affected,Reconstruction Costs ('000 US$),"Reconstruction Costs, Adjusted ('000 US$)",Insured Damage ('000 US$),"Insured Damage, Adjusted ('000 US$)",Total Damage ('000 US$),"Total Damage, Adjusted ('000 US$)",CPI,Admin Units,Entry Date,Last Update
2000-0332-IND,No,nat-hyd-flo-fla,Natural,Hydrological,Flood,Flash flood,,,IND,India,Southern Asia,Asia,"Yingkiang,Tuting villages (Upper Siang (70051) district, Arunachal Pradesh province), Along, Boleng villages (70054 district, Arunachal Pradesh province), Pasighat, Sika-bamin, Komlighat, Raneghat (70041 district, Arunachal Pradesh province), Tezu, Mahadevpur villages (Lohit district, Arunachal Pradesh province), Golaghat, Nagaon districts (Assam province), ",,Broken Dam/Burst bank,No,No,No,,55000,Km2,,,,2000,6,10,2000,6,10,20,,3000000,,3000000,,,,,,,56.5142905592776,"[{""adm2_code"":17582,""adm2_name"":""Golaghat""},{""adm2_code"":17589,""adm2_name"":""Nagaon""},{""adm2_code"":70041,""adm2_name"":""Administrative unit not available""},{""adm2_code"":70051,""adm2_name"":""Administrative unit not available""},{""adm2_code"":70054,""adm2_name"":""Administrative unit not available""},{""adm2_code"":17571,""adm2_name"":""East Siang""},{""adm2_code"":17572,""adm2_name"":""Lohit""},{""adm2_code"":17575,""adm2_name"":""West Siang""}]",2005-09-15,2023-09-25
2000-0373-BGD,No,nat-hyd-flo-fla,Natural,Hydrological,Flood,Flash flood,,,BGD,Bangladesh,Southern Asia,Asia,"Bakalia, Kotwali, Chandgaon, Pahartali, Hathazari, Halishahar, Patiya, Satkania areas (Chittagong district, Chittagong province), Cox's Bazar district (Chittagong province)",Monsoonal rain,"Slide (land, mud, snow, rock)",No,No,No,,17000,Km2,,,"Bramputra, Darata",2000,6,24,2000,6,24,11,50,200000,,200050,,,,,,,56.5142905592776,"[{""adm2_code"":5770,""adm2_name"":""Chittagong""},{""adm2_code"":5772,""adm2_name"":""Cox's Bazar""}]",2004-10-25,2023-09-25
2000-0444-IND,No,nat-hyd-flo-fla,Natural,Hydrological,Flood,Flash flood,,,IND,India,Southern Asia,Asia,"East Siang, 70041, West Siang, 70054, Upper Siang (70051), 70045, 70050, Lower Dibang Valley districts (Arunachal Pradesh province)",,,No,No,No,,,Km2,,,,2000,7,,2000,7,,130,,,,,,,,,,,56.5142905592776,"[{""adm2_code"":70041,""adm2_name"":""Administrative unit not available""},{""adm2_code"":70045,""adm2_name"":""Administrative unit not available""},{""adm2_code"":70050,""adm2_name"":""Administrative unit not available""},{""adm2_code"":70051,""adm2_name"":""Administrative unit not available""},{""adm2_code"":70054,""adm2_name"":""Administrative unit not available""},{""adm2_code"":17571,""adm2_name"":""East Siang""},{""adm2_code"":17575,""adm2_name"":""West Siang""},{""adm2_code"":70084,""adm2_name"":""Lower Dibang Valley""}]",2003-07-01,2023-09-25
2000-0445-IND,No,nat-hyd-flo-riv,Natural,Hydrological,Flood,Riverine flood,,,IND,India,Southern Asia,Asia,"Katihar, Sitamarhi districts (Bihar province), Kinnaur district (Himachal Pradesh province), Bankura, Barddhaman, Birbhum, Haora, Hugli, Maldah, Murshidabad, Nadia, North 24 Parganas, West Midnapore districts (West Bengal province), Pithoragarh, Naini Tal districts (Uttarakhand province), Ahmadabad district (Gujarat province), Andhra Pradesh, Assam, Arunachal Pradesh, Madhya Pradesh, Punjab, Uttar Pradesh, Maharashtra, Rajasthan, Chandigarh, Kerala",Monsoonal rain,,Yes,No,No,7087,300000,Km2,,,"Brahmaputra and its tributaries, Bagmati, Kosi, Gandak, Murigandak, Kamlabalan, Mahananada, Adhwara, Ganges, Bhagra, Ganga, Burhi Gandak, Bagmati and Punpun",2000,8,2,2000,8,30,867,,22000000,,22000000,,,,,43000,76087,56.5142905592776,"[{""adm1_code"":1485,""adm1_name"":""Andhra Pradesh""},{""adm1_code"":1487,""adm1_name"":""Assam""},{""adm1_code"":1495,""adm1_name"":""Kerala""},{""adm1_code"":1498,""adm1_name"":""Maharashtra""},{""adm1_code"":1505,""adm1_name"":""Punjab""},{""adm1_code"":1506,""adm1_name"":""Rajasthan""},{""adm1_code"":70036,""adm1_name"":""Administrative unit not available""},{""adm1_code"":70037,""adm1_name"":""Administrative unit not available""},{""adm1_code"":70072,""adm1_name"":""Arunachal Pradesh""},{""adm1_code"":70074,""adm1_name"":""Chandigarh""},{""adm1_code"":70079,""adm1_name"":""Madhya Pradesh""},{""adm1_code"":70081,""adm1_name"":""Uttar Pradesh""},{""adm2_code"":17635,""adm2_name"":""Ahmadabad""},{""adm2_code"":17670,""adm2_name"":""Kinnaur""},{""adm2_code"":17945,""adm2_name"":""Bankura""},{""adm2_code"":17946,""adm2_name"":""Barddhaman""},{""adm2_code"":17947,""adm2_name"":""Birbhum""},{""adm2_code"":17949,""adm2_name"":""Haora""},{""adm2_code"":17950,""adm2_name"":""Hugli""},{""adm2_code"":17953,""adm2_name"":""Maldah""},{""adm2_code"":17955,""adm2_name"":""Murshidabad""},{""adm2_code"":17956,""adm2_name"":""Nadia""},{""adm2_code"":70293,""adm2_name"":""North 24 Parganas""},{""adm2_code"":70296,""adm2_name"":""West Midnapore""},{""adm2_code"":17608,""adm2_name"":""Katihar""},{""adm2_code"":17630,""adm2_name"":""Sitamarhi""},{""adm2_code"":17932,""adm2_name"":""Pithoragarh""},{""adm2_code"":70285,""adm2_name"":""Naini Tal""}]",2008-01-03,2023-09-25
2000-0476-NPL,No,nat-hyd-flo-flo,Natural,Hydrological,Flood,Flood (General),,,NPL,Nepal,Southern Asia,Asia,"Dhading, Lalitpur areas (Bagmati district, Central province), Dolakha, Sarlahi areas (Janakpur district, Central province), Makwanpur, Parsa, Rautahat areas (Narayani district, Central province), Bhojpur, Morang, Sunsari, Terhathum areas (Koshi district, Eastern province), Siraha, Saptari areas (Sagarmatha district, Eastern province), Baitadi, Darchula areas (Mahakali district, Far Western province), Kailali area (Seti district, Far Western province), Banke, Dailekh areas (Bheri district, Mid Western province), Salyan area (Rapti district, Mid Western province), Baglung area (Dhawalagiri district, Western province), Argakhachi area (Lumbini district, Western province), Gorkha, Lamjung, Tanahu, Kaski areas (Gandaki district, Western province), Mechi district (Eastern province)",,,No,No,No,481,,Km2,,,,2000,6,,2000,6,,144,70,50000,,50070,,,,,6300,11148,56.5142905592776,"[{""adm2_code"":22351,""adm2_name"":""Bagmati""},{""adm2_code"":22352,""adm2_name"":""Janakpur""},{""adm2_code"":22353,""adm2_name"":""Narayani""},{""adm2_code"":22354,""adm2_name"":""Koshi""},{""adm2_code"":22355,""adm2_name"":""Mechi""},{""adm2_code"":22356,""adm2_name"":""Sagarmatha""},{""adm2_code"":22357,""adm2_name"":""Mahakali""},{""adm2_code"":22358,""adm2_name"":""Seti""},{""adm2_code"":22360,""adm2_name"":""Rapti""},{""adm2_code"":22361,""adm2_name"":""Bheri""},{""adm2_code"":22362,""adm2_name"":""Dhawalagiri""},{""adm2_code"":22363,""adm2_name"":""Gandaki""},{""adm2_code"":22364,""adm2_name"":""Lumbini""}]",2007-04-17,2023-09-25
2000-0484-BTN,No,nat-hyd-flo-riv,Natural,Hydrological,Flood,Riverine flood,,,BTN,Bhutan,Southern Asia,Asia,"Pasakha area (Sampheling district, Chhukha province), Phuentshogling city (Phuentshogling district, Chhukha province)",Monsoonal rain,"Slide (land, mud, snow, rock)",No,No,No,50,,Km2,,,"Brahmaputra, Varsha",2000,8,2,2000,8,30,200,,,1000,1000,,,,,,,56.5142905592776,"[{""adm2_code"":5943,""adm2_name"":""Sampheling""},{""adm2_code"":5953,""adm2_name"":""Phuentshogling""}]",2005-09-15,2023-09-25
2000-0499-IRN,No,nat-hyd-flo-fla,Natural,Hydrological,Flood,Flash flood,,,IRN,Iran (Islamic Republic of),Southern Asia,Asia,"Maneh Va Samalqan area (Bojnord district, Khorasan province)",Brief torrential rain,,No,No,No,,16200,Km2,,,,2000,8,8,2000,8,9,8,,400,,400,,,,,6000,10617,56.5142905592776,"[{""adm2_code"":40910,""adm2_name"":""Bojnord""}]",2004-10-21,2023-09-25
2000-0534-IND,No,nat-hyd-flo-fla,Natural,Hydrological,Flood,Flash flood,,,IND,India,Southern Asia,Asia,"Adilabad, Cuddapah, East Godavari, Guntur, Hyderabad, Karimnagar, Khammam, Krishna, Kurnool, Mahbubnagar, Medak, Nalgonda, Nellore, Nizamabad, Prakasam, Rangareddi, Vishakhapatnam, Warangal, West Godavari districts (Andhra Pradesh province)",Brief torrential rain,,No,No,No,,129500,Km2,,,Godavari,2000,8,23,2000,8,31,179,16,,252000,252016,,,,,173000,306117,56.5142905592776,"[{""adm2_code"":17547,""adm2_name"":""Adilabad""},{""adm2_code"":17550,""adm2_name"":""Cuddapah""},{""adm2_code"":17551,""adm2_name"":""East Godavari""},{""adm2_code"":17552,""adm2_name"":""Guntur""},{""adm2_code"":17553,""adm2_name"":""Hyderabad""},{""adm2_code"":17554,""adm2_name"":""Karimnagar""},{""adm2_code"":17555,""adm2_name"":""Khammam""},{""adm2_code"":17556,""adm2_name"":""Krishna""},{""adm2_code"":17557,""adm2_name"":""Kurnool""},{""adm2_code"":17558,""adm2_name"":""Mahbubnagar""},{""adm2_code"":17559,""adm2_name"":""Medak""},{""adm2_code"":17560,""adm2_name"":""Nalgonda""},{""adm2_code"":17561,""adm2_name"":""Nellore""},{""adm2_code"":17562,""adm2_name"":""Nizamabad""},{""adm2_code"":17563,""adm2_name"":""Prakasam""},{""adm2_code"":17564,""adm2_name"":""Rangareddi""},{""adm2_code"":17566,""adm2_name"":""Vishakhapatnam""},{""adm2_code"":17568,""adm2_name"":""Warangal""},{""adm2_code"":17569,""adm2_name"":""West Godavari""}]",2006-02-23,2023-09-25
2000-0555-BGD,No,nat-hyd-flo-coa,Natural,Hydrological,Flood,Coastal flood,,,BGD,Bangladesh,Southern Asia,Asia,"Hutiya, Companiganj areas (Noakhali district, Chittagong province), Maheskhali area (Cox's Bazar district, Chittagong province), Sandwip area (Chittagong district, Chittagong province)",,,No,No,No,,,Km2,,,,2000,8,30,2000,8,30,1,10,,12000,12010,,,,,,,56.5142905592776,"[{""adm2_code"":5770,""adm2_name"":""Chittagong""},{""adm2_code"":5772,""adm2_name"":""Cox's Bazar""},{""adm2_code"":5776,""adm2_name"":""Noakhali""}]",2003-07-01,2023-09-25
2000-0610-IND,No,nat-hyd-flo-riv,Natural,Hydrological,Flood,Riverine flood,,,IND,India,Southern Asia,Asia,"Birbhum, Bardhaman, Murshidabad, Maldah districts (West Bengal province), Dumka, Sahibganj, Deoghar districts (Jharkhand province), Banka, Bhagalpur, Munger, Sheikhpura districts (Bihar province)",Monsoonal rain,,No,No,No,,12680,Km2,,,"Ganges, Kosi, Bagmati, Burhi Ganduk, Hoogly, Kharia, Ichamati and Jamuna",2000,9,18,2000,10,21,884,,24600000,,24600000,,,,,691500,1223584,56.5142905592776,"[{""adm2_code"":17946,""adm2_name"":""Barddhaman""},{""adm2_code"":17947,""adm2_name"":""Birbhum""},{""adm2_code"":17953,""adm2_name"":""Maldah""},{""adm2_code"":17955,""adm2_name"":""Murshidabad""},{""adm2_code"":17596,""adm2_name"":""Bhagalpur""},{""adm2_code"":17614,""adm2_name"":""Munger""},{""adm2_code"":70095,""adm2_name"":""Banka""},{""adm2_code"":70102,""adm2_name"":""Sheikhpura""},{""adm2_code"":17600,""adm2_name"":""Deoghar""},{""adm2_code"":70142,""adm2_name"":""Dumka""},{""adm2_code"":70154,""adm2_name"":""Sahibganj""}]",2005-09-15,2023-09-25
2000-0613-LKA,No,nat-hyd-flo-riv,Natural,Hydrological,Flood,Riverine flood,,,LKA,Sri Lanka,Southern Asia,Asia,"Galle, Matara districts (Southern province)",Heavy rains,,No,No,No,,8000,Km2,,,Gin Ganga,2000,9,18,2000,9,22,2,,100000,,100000,,,,,,,56.5142905592776,"[{""adm2_code"":25846,""adm2_name"":""Galle""},{""adm2_code"":25848,""adm2_name"":""Matara""}]",2004-10-21,2023-09-25
2000-0617-BGD,No,nat-hyd-flo-fla,Natural,Hydrological,Flood,Flash flood,,,BGD,Bangladesh,Southern Asia,Asia,"Gangni, Meherpur Sadar areas (Meherpur district, Khulna province), Daulatpur, Kushtia Sadar, Bheramara areas (Kushtia district, Khulna province), Jibannagar, Alamdanga, Cuadanda Sadar, Damurhuda areas (Chuadanga district, Khulna province), Maheshpur, Kotchandpur areas (Jhenaidah district, Khulna province), Paba, Godagari, Tanor, Mohanpur areas (Rajshahi district, Rajshahi province)",,,No,No,No,4675,162,Km2,,,,2000,9,,2000,10,,31,,2467138,,2467138,,,,,500000,884732,56.5142905592776,"[{""adm2_code"":5796,""adm2_name"":""Chuadanga""},{""adm2_code"":5798,""adm2_name"":""Jhenaidah""},{""adm2_code"":5800,""adm2_name"":""Kushtia""},{""adm2_code"":5802,""adm2_name"":""Meherpur""},{""adm2_code"":5817,""adm2_name"":""Rajshahi""}]",2005-07-19,2023-09-25
2000-0618-IRN,No,nat-hyd-flo-flo,Natural,Hydrological,Flood,Flood (General),,,IRN,Iran (Islamic Republic of),Southern Asia,Asia,Gonbad-e Kavus district (Golestan province),,,No,No,No,,,Km2,,,,2000,9,24,2000,9,24,2,,,,,,,,,,,56.5142905592776,"[{""adm2_code"":40968,""adm2_name"":""Gonbad-e Kavus""}]",2003-07-01,2023-09-25
2000-0738-IND,No,nat-hyd-flo-flo,Natural,Hydrological,Flood,Flood (General),,,IND,India,Southern Asia,Asia,North 24 Parganas district (West Bengal province),,,No,No,No,,309,Km2,,,,2000,10,19,2000,10,19,6,,534035,,534035,,,,,,,56.5142905592776,"[{""adm2_code"":70293,""adm2_name"":""North 24 Parganas""}]",2003-07-01,2023-09-25
2000-0741-LKA,No,nat-hyd-flo-riv,Natural,Hydrological,Flood,Riverine flood,,,LKA,Sri Lanka,Southern Asia,Asia,"Ampara, Batticaloa districts (Eastern province), Polonnaruwa district (North Central province)",Monsoonal rain,,No,No,No,,7600,Km2,,,,2000,11,18,2000,11,22,3,,300000,,300000,,,,,3000,5308,56.5142905592776,"[{""adm2_code"":25832,""adm2_name"":""Ampara""},{""adm2_code"":25833,""adm2_name"":""Batticaloa""},{""adm2_code"":25836,""adm2_name"":""Polonnaruwa""}]",2004-10-19,2023-09-25
2000-0862-IRN,No,nat-hyd-flo-fla,Natural,Hydrological,Flood,Flash flood,,,IRN,Iran (Islamic Republic of),Southern Asia,Asia,"Lorestan, Khuzestan, Gilan provinces",Brief torrential rains,,No,No,No,,83730,Km2,,,,2000,11,30,2000,12,2,,,,,,,,,,,,56.5142905592776,"[{""adm1_code"":1545,""adm1_name"":""Gilan""},{""adm1_code"":1551,""adm1_name"":""Khuzestan""},{""adm1_code"":1555,""adm1_name"":""Lorestan""}]",2004-10-18,2023-09-25
2001-0049-LKA,No,nat-hyd-flo-flo,Natural,Hydrological,Flood,Flood (General),,,LKA,Sri Lanka,Southern Asia,Asia,Matale district (Central province),,,No,No,No,,,Km2,,,,2001,2,,2001,2,,,,,160,160,,,,,,,58.1114743743821,"[{""adm2_code"":25830,""adm2_name"":""Matale""}]",2003-07-01,2023-09-25
2001-0180-IRN,No,nat-hyd-flo-fla,Natural,Hydrological,Flood,Flash flood,,,IRN,Iran (Islamic Republic of),Southern Asia,Asia,Bojnord district (Khorasan province),Brief torrential rain,,No,No,No,,2130,Km2,,,,2001,5,6,2001,5,6,32,50,1250,,1300,,,,,,,58.1114743743821,"[{""adm2_code"":40910,""adm2_name"":""Bojnord""}]",2005-09-19,2023-09-25
2001-0243-IND,No,nat-hyd-flo-riv,Natural,Hydrological,Flood,Riverine flood,,,IND,India,Southern Asia,Asia,"Silchar city (Cachar district, Assam province), Patharkandi village (Karimganj district, Assam province), West Tripura district (Tripura province)",Moosonal rain,,No,No,No,,,Km2,,,,2001,6,5,2001,6,22,5,,700000,,700000,,,,,,,58.1114743743821,"[{""adm2_code"":17577,""adm2_name"":""Cachar""},{""adm2_code"":17585,""adm2_name"":""Karimganj""},{""adm2_code"":17887,""adm2_name"":""West Tripura""}]",2005-09-19,2023-09-25
2001-0332-IND,No,nat-hyd-flo-riv,Natural,Hydrological,Flood,Riverine flood,,,IND,India,Southern Asia,Asia,"Marshagal, Mahakalpada villages (Kendrapara district, Orissa province), Kakatpur, Astaranga, Kanas, Delanga villages (Puri district, Orissa province), Banki, Kantapada villages (Cuttack district, Orissa province), Balipatna villages (Khordha district, Orissa province), Atharmalik villages (Angul district, Orissa province), Jajpur, Jagatsinghpur, Kalahandi, Koraput, Bolangir, Nayagarh, Baleshwar, Bhadrak districts (Orissa province), Dhamtari, Raipur, Mahasamund, Janjgir-Champa, Raigarh districts (Chhattisgarh province)",Monsoonal rain,,Yes,No,No,6430,105100,Km2,,,,2001,7,8,2001,7,10,100,,9670000,,9670000,,,,,90000,154875,58.1114743743821,"[{""adm2_code"":17809,""adm2_name"":""Cuttack""},{""adm2_code"":17812,""adm2_name"":""Kalahandi""},{""adm2_code"":17814,""adm2_name"":""Koraput""},{""adm2_code"":17818,""adm2_name"":""Puri""},{""adm2_code"":70206,""adm2_name"":""Angul""},{""adm2_code"":70207,""adm2_name"":""Baleshwar""},{""adm2_code"":70209,""adm2_name"":""Bhadrak""},{""adm2_code"":70210,""adm2_name"":""Bolangir""},{""adm2_code"":70214,""adm2_name"":""Jagatsinghpur""},{""adm2_code"":70215,""adm2_name"":""Jajpur""},{""adm2_code"":70218,""adm2_name"":""Kendrapara""},{""adm2_code"":70219,""adm2_name"":""Khordha""},{""adm2_code"":70222,""adm2_name"":""Nayagarh""},{""adm2_code"":70108,""adm2_name"":""Dhamtari""},{""adm2_code"":70109,""adm2_name"":""Janjgir-Champa""},{""adm2_code"":70115,""adm2_name"":""Mahasamund""},{""adm2_code"":70116,""adm2_name"":""Raipur""},{""adm2_code"":70297,""adm2_name"":""Raigarh""}]",2005-09-20,2023-09-25
2001-0349-IND,No,nat-hyd-flo-flo,Natural,Hydrological,Flood,Flood (General),,,IND,India,Southern Asia,Asia,"Hosdurg borough (Kanhangad city, Kasaragod district, Kerala province), Vertak Nagar area (Thane district, Maharashtra province), Bhandup area (Mumbai Suburban district, Maharashtra province)",,,No,No,No,,,Km2,,,,2001,6,,2001,6,,28,4,,,4,,,,,,,58.1114743743821,"[{""adm2_code"":17701,""adm2_name"":""Kasaragod""},{""adm2_code"":17783,""adm2_name"":""Thane""},{""adm2_code"":70183,""adm2_name"":""Mumbai Suburban""}]",2003-07-01,2023-09-25
2001-0375-IRN,No,nat-hyd-flo-riv,Natural,Hydrological,Flood,Riverine flood,,,IRN,Iran (Islamic Republic of),Southern Asia,Asia,"Meshkinshahr district (Ardebil province), Siyah Cheshmeh district (West Azarbayejan province)",Heavy rain,,No,No,No,,7440,Km2,,,,2001,7,20,2001,7,21,32,34,1000,,1034,,,,,25000,43021,58.1114743743821,"[{""adm2_code"":41117,""adm2_name"":""Siyah Cheshmeh""},{""adm2_code"":41035,""adm2_name"":""Meshkinshahr""}]",2005-09-20,2023-09-25
2001-0376-PAK,No,nat-hyd-flo-fla,Natural,Hydrological,Flood,Flash flood,,,PAK,Pakistan,Southern Asia,Asia,"Islamabad district (Islamabad province), Rawalpindi district (Punjab province), North-West Frontier province",Brief torrential rain,"Slide (land, mud, snow, rock)",No,No,No,436,111100,Km2,,,"Siran, Leh rivers",2001,7,22,2001,7,25,210,179,400000,,400179,,,,,246000,423324,58.1114743743821,"[{""adm1_code"":2275,""adm1_name"":""North-West Frontier""},{""adm2_code"":23638,""adm2_name"":""Islamabad District""},{""adm2_code"":23674,""adm2_name"":""Rawalpindi District""}]",2005-09-20,2023-09-25
2001-0387-IND,No,nat-hyd-flo-riv,Natural,Hydrological,Flood,Riverine flood,,,IND,India,Southern Asia,Asia,"Idukki, Kottayam, Pattanamtitta, Kollam, Alappuzha districts (Kerala province)",Monsoonal rain,,No,No,No,,4470,Km2,,,,2001,7,4,2001,7,16,86,,40000,,40000,,,,,116924,201206,58.1114743743821,"[{""adm2_code"":17700,""adm2_name"":""Idukki""},{""adm2_code"":17702,""adm2_name"":""Kottayam""},{""adm2_code"":17706,""adm2_name"":""Pattanamtitta""},{""adm2_code"":17707,""adm2_name"":""Kollam""},{""adm2_code"":70298,""adm2_name"":""Alappuzha""}]",2005-09-20,2023-09-25
2001-0393-BGD,No,nat-hyd-flo-riv,Natural,Hydrological,Flood,Riverine flood,,,BGD,Bangladesh,Southern Asia,Asia,"Nilphamari district (Rangpur province), Brahamanbaria district (Chittagong province), Sylhet province",,,No,No,No,,,Km2,,,,2001,6,5,2001,6,5,9,,500000,,500000,,,,,,,58.1114743743821,"[{""adm1_code"":580,""adm1_name"":""Sylhet""},{""adm2_code"":5768,""adm2_name"":""Brahamanbaria""},{""adm2_code"":5814,""adm2_name"":""Nilphamari""}]",2003-07-01,2023-09-25
2001-0453-IRN,No,nat-hyd-flo-fla,Natural,Hydrological,Flood,Flash flood,,,IRN,Iran (Islamic Republic of),Southern Asia,Asia,"Golestan, Khorasan, Semnan provinces",Brief torrential rain,,No,Yes,No,732,77940,Km2,,,,2001,8,10,2001,8,12,412,200,1200000,,1200200,,,,,78800,135601,58.1114743743821,"[{""adm1_code"":1547,""adm1_name"":""Khorasan""},{""adm1_code"":1558,""adm1_name"":""Semnan""},{""adm1_code"":33111,""adm1_name"":""Golestan""}]",2004-10-29,2023-09-25
2001-0459-BGD,No,nat-hyd-flo-flo,Natural,Hydrological,Flood,Flood (General),,,BGD,Bangladesh,Southern Asia,Asia,"Sunamganj, Sylhet districts (Sylhet province), Nawabganj, Rajshahi districts (Rajshahi province), Kushtia district (Khulna province)",,,No,No,No,,,Km2,,,,2001,8,31,2001,8,31,,,200000,,200000,,,,,,,58.1114743743821,"[{""adm2_code"":5800,""adm2_name"":""Kushtia""},{""adm2_code"":5823,""adm2_name"":""Sunamganj""},{""adm2_code"":5824,""adm2_name"":""Sylhet""},{""adm2_code"":5813,""adm2_name"":""Nawabganj""},{""adm2_code"":5817,""adm2_name"":""Rajshahi""}]",2003-07-01,2023-09-25
2001-0465-IND,No,nat-hyd-flo-riv,Natural,Hydrological,Flood,Riverine flood,,,IND,India,Southern Asia,Asia,"Aurangabad, Bhojpur, Gopalganj, Jehanabad, Muzaffarpur, Nalanda, Pashchim Champaran, Patna, Purba Champaran, Rohtas, Saran, Sitamarhi, Siwan, Vaishali districts (Bihar province)",,,No,No,No,,,Km2,,,,2001,8,,2001,8,,,,400000,,400000,,,,,,,58.1114743743821,"[{""adm2_code"":17594,""adm2_name"":""Aurangabad""},{""adm2_code"":17604,""adm2_name"":""Gopalganj""},{""adm2_code"":17607,""adm2_name"":""Jehanabad""},{""adm2_code"":17613,""adm2_name"":""Muzaffarpur""},{""adm2_code"":17615,""adm2_name"":""Nalanda""},{""adm2_code"":17618,""adm2_name"":""Pashchim Champaran""},{""adm2_code"":17619,""adm2_name"":""Patna""},{""adm2_code"":17620,""adm2_name"":""Purba Champaran""},{""adm2_code"":17623,""adm2_name"":""Rohtas""},{""adm2_code"":17628,""adm2_name"":""Saran""},{""adm2_code"":17630,""adm2_name"":""Sitamarhi""},{""adm2_code"":17631,""adm2_name"":""Siwan""},{""adm2_code"":17632,""adm2_name"":""Vaishali""},{""adm2_code"":70097,""adm2_name"":""Bhojpur""}]",2003-07-01,2023-09-25
2001-0502-IND,No,nat-hyd-flo-flo,Natural,Hydrological,Flood,Flood (General),,,IND,India,Southern Asia,Asia,Delhi province,,,No,No,No,,,Km2,,,,2001,8,,2001,8,,10,36,,,36,,,,,,,58.1114743743821,"[{""adm1_code"":1489,""adm1_name"":""Delhi""}]",2003-07-01,2023-09-25
2001-0515-IND,No,nat-hyd-flo-flo,Natural,Hydrological,Flood,Flood (General),,,IND,India,Southern Asia,Asia,"Gopalganj, Purba Champaran, Pashchim Champaran, Muzaffarpur, Vaishali, Saran districts (Bihar province)",,,No,No,No,,550,Km2,,,,2001,8,20,2001,8,20,158,,7000000,,7000000,,,,,26000,44742,58.1114743743821,"[{""adm2_code"":17604,""adm2_name"":""Gopalganj""},{""adm2_code"":17613,""adm2_name"":""Muzaffarpur""},{""adm2_code"":17618,""adm2_name"":""Pashchim Champaran""},{""adm2_code"":17620,""adm2_name"":""Purba Champaran""},{""adm2_code"":17628,""adm2_name"":""Saran""},{""adm2_code"":17632,""adm2_name"":""Vaishali""}]",2003-07-01,2023-09-25
2001-0527-IND,No,nat-hyd-flo-fla,Natural,Hydrological,Flood,Flash flood,,,IND,India,Southern Asia,Asia,"Saran, Gopalganj, Purba Champaran, Madhubani districts (Bihar province), Uttar Pradesh province",,,No,No,No,,,Km2,,,,2001,9,,2001,9,,48,,2800000,,2800000,,,,,26000,44742,58.1114743743821,"[{""adm1_code"":70081,""adm1_name"":""Uttar Pradesh""},{""adm2_code"":17604,""adm2_name"":""Gopalganj""},{""adm2_code"":17611,""adm2_name"":""Madhubani""},{""adm2_code"":17620,""adm2_name"":""Purba Champaran""},{""adm2_code"":17628,""adm2_name"":""Saran""}]",2003-07-01,2023-09-25
2001-0545-IRN,No,nat-hyd-flo-fla,Natural,Hydrological,Flood,Flash flood,,,IRN,Iran (Islamic Republic of),Southern Asia,Asia,"Mazandaran, Gilan provinces",Brief torrential rain,,No,No,No,,27360,Km2,,,,2001,10,1,2001,10,2,,,3000,,3000,,,,,,,58.1114743743821,"[{""adm1_code"":1545,""adm1_name"":""Gilan""},{""adm1_code"":1557,""adm1_name"":""Mazandaran""}]",2004-10-28,2023-09-25
2001-0794-IND,No,nat-hyd-flo-flo,Natural,Hydrological,Flood,Flood (General),,,IND,India,Southern Asia,Asia,"Saran, Gopalganj districts (Bihar province)",,,No,No,No,,,Km2,,,,2001,9,7,2001,9,24,146,,,,,,,,,103000,177246,58.1114743743821,"[{""adm2_code"":17604,""adm2_name"":""Gopalganj""},{""adm2_code"":17628,""adm2_name"":""Saran""}]",2006-07-20,2023-09-25
2002-0020-IRN,No,nat-hyd-flo-riv,Natural,Hydrological,Flood,Riverine flood,,,IRN,Iran (Islamic Republic of),Southern Asia,Asia,"Bushehr, Fars, Khuzestan, Kerman provinces",Heavy rains,,No,No,No,,59660,Km2,,,,2002,1,11,2002,1,13,11,,,4500,4500,,,,,59060,100045,59.0331440786142,"[{""adm1_code"":1540,""adm1_name"":""Bushehr""},{""adm1_code"":1544,""adm1_name"":""Fars""},{""adm1_code"":1550,""adm1_name"":""Kerman""},{""adm1_code"":1551,""adm1_name"":""Khuzestan""}]",2004-03-24,2023-09-25
2002-0185-AFG,No,nat-hyd-flo-flo,Natural,Hydrological,Flood,Flood (General),,,AFG,Afghanistan,Southern Asia,Asia,"Yulmarab village (Mazar-e-Sharif district, Balkh province)",,,No,No,No,,,Km2,,,,2002,3,22,2002,3,22,,,120,,120,,,,,,,59.0331440786142,"[{""adm2_code"":3487,""adm2_name"":""Mazar-e-Sharif""}]",2003-07-01,2023-09-25
2002-0196-AFG,No,nat-hyd-flo-riv,Natural,Hydrological,Flood,Riverine flood,,,AFG,Afghanistan,Southern Asia,Asia,"Deh Miran area (Garziwan district, Faryab province)",Heavy rain,,No,No,No,,1170,Km2,,,Maimana,2002,4,4,2002,7,4,39,,4225,,4225,,,,,,,59.0331440786142,"[{""adm2_code"":99955,""adm2_name"":""Garziwan""}]",2005-09-22,2023-09-25
2002-0218-IRN,No,nat-hyd-flo-riv,Natural,Hydrological,Flood,Riverine flood,,,IRN,Iran (Islamic Republic of),Southern Asia,Asia,"Bandar-e abbas district (Hormozgan province), Yazd, Esfahan provinces",Heavy rain,,No,No,No,,44880,Km2,,,,2002,4,14,2002,4,16,11,,,,,,,,,,,59.0331440786142,"[{""adm1_code"":1543,""adm1_name"":""Esfahan""},{""adm1_code"":1562,""adm1_name"":""Yazd""},{""adm2_code"":40896,""adm2_name"":""Bandar-e abbas""}]",2005-09-22,2023-09-25
2002-0242-AFG,No,nat-hyd-flo-riv,Natural,Hydrological,Flood,Riverine flood,,,AFG,Afghanistan,Southern Asia,Asia,"Qala-e-Naw, Abkamari districts (Badghis province)",Heavy rain,,No,No,No,,3650,Km2,,,,2002,4,23,2002,4,26,7,,1200,,1200,,,,,,,59.0331440786142,"[{""adm2_code"":99953,""adm2_name"":""Abkamari""},{""adm2_code"":100024,""adm2_name"":""Qala-e-Naw""}]",2005-09-22,2023-09-25
